/Reviews,,,,,,,,,,,,,
u,u,u,Review-g2369819-d4736237_2,216,Review-g2369819-d4736237_2:6,,1295,SERVICE#GENERAL,63,negative,gastvrouw,72,"Het eten was niet slecht, maar dat kon de onbeleefdheid van de gastvrouw niet goed maken."
u,u,u,Review-g2369819-d4736237_2,216,Review-g2369819-d4736237_2:7,TRUE,1296,,,,,,Genoeg restaurants in Destelbergen waar ze niet tegen hun zin werken.
u,u,u,Review-g2369819-d4736237_3,217,Review-g2369819-d4736237_3:1,,1297,AMBIENCE#GENERAL,95,negative,interieur,104,"Aanvankelijk hadden mijn vriend en ik wel wat ""drempelvrees"" om hier binnen te komen, daar het interieur er wat rommelig uitzag."
u,u,u,Review-g2369819-d4736237_3,217,Review-g2369819-d4736237_3:2,,1298,RESTAURANT#GENERAL,0,positive,NULL,0,Maar we overwonnen onze schrik en kregen de verrassing van ons leven!
u,u,u,Review-g2369819-d4736237_3,217,Review-g2369819-d4736237_3:3,,1299,AMBIENCE#GENERAL,98,positive,restaurantje,110,"We werden geweldig vriendelijk onthaald en voelden ons meteen thuis in dit sympathieke, familiale restaurantje."
u,u,u,Review-g2369819-d4736237_3,217,Review-g2369819-d4736237_3:3,,1299,SERVICE#GENERAL,0,positive,NULL,0,"We werden geweldig vriendelijk onthaald en voelden ons meteen thuis in dit sympathieke, familiale restaurantje."
u,u,u,Review-g2369819-d4736237_3,217,Review-g2369819-d4736237_3:4,,1300,AMBIENCE#GENERAL,0,neutral,NULL,0,"Helemaal niet sjiek of zo, eerder eenvoudig, je waant je in een Italiaanse huiskamer..."
u,u,u,Review-g2369819-d4736237_3,217,Review-g2369819-d4736237_3:5,,1301,RESTAURANT#GENERAL,70,positive,etna,74,"Het eten was geweldig, nooit heb ik Italië zo nabij gevoeld als in de Etna."
u,u,u,Review-g2369819-d4736237_3,217,Review-g2369819-d4736237_3:5,,1301,FOOD#QUALITY,4,positive,eten,8,"Het eten was geweldig, nooit heb ik Italië zo nabij gevoeld als in de Etna."
u,u,u,Review-g2369819-d4736237_3,217,Review-g2369819-d4736237_3:6,,1302,FOOD#QUALITY,3,positive,kok,6,"De kok heeft prijzen gewonnen voor ""beste pizzaiolo van Vlaanderen'"" en is hier heel trots op."
u,u,u,Review-g2369819-d4736237_3,217,Review-g2369819-d4736237_3:7,,1303,,,,,,De foto's en getuigschriften hangen aan de muur.
u,u,u,Review-g2369819-d4736237_3,217,Review-g2369819-d4736237_3:8,,1304,RESTAURANT#GENERAL,0,positive,NULL,0,Tot nu toe mijn beste ervaring met de authentieke Italiaanse keuken in ons Belgenlandje.
u,u,u,Review-g2369819-d4736237_3,217,Review-g2369819-d4736237_3:9,,1305,RESTAURANT#PRICES,0,positive,NULL,0,Ook de prijs is heel redelijk.
u,u,u,Review-g2369819-d4736237_3,217,Review-g2369819-d4736237_3:10,,1306,RESTAURANT#GENERAL,0,positive,NULL,0,"Ik kom hier zéker terug, zeker weten!!!!"
u,u,u,Review-g2369819-d4736237_4,218,Review-g2369819-d4736237_4:1,,1307,FOOD#QUALITY,25,positive,pizza's,32,Super lekkere pasta's en pizza's gegeten!
u,u,u,Review-g2369819-d4736237_4,218,Review-g2369819-d4736237_4:1,,1307,FOOD#QUALITY,14,positive,pasta's,21,Super lekkere pasta's en pizza's gegeten!
u,u,u,Review-g2369819-d4736237_4,218,Review-g2369819-d4736237_4:2,,1308,,,,,,"De kok, Mateo is een Italiaan."
u,u,u,Review-g2369819-d4736237_4,218,Review-g2369819-d4736237_4:3,,1309,SERVICE#GENERAL,11,positive,ontvangst,20,"Hartelijke ontvangst, goed om vooraf te reserveren."
u,u,u,Review-g2369819-d4736237_4,218,Review-g2369819-d4736237_4:4,,1310,RESTAURANT#PRICES,0,neutral,NULL,0,prijs is gemiddeld.
u,u,u,Review-g2369819-d4736237_4,218,Review-g2369819-d4736237_4:5,,1311,FOOD#QUALITY,7,positive,formule 'pizza party,27,Ook de formule 'pizza party' is een schot in de roos!!
u,u,u,Review-g2369819-d4736237_4,218,Review-g2369819-d4736237_4:6,,1312,AMBIENCE#GENERAL,18,neutral,zonneterras,29,In de zomer groot zonneterras.
u,u,u,Review-g2546789-d4542241_2,219,Review-g2546789-d4542241_2:1,,1313,FOOD#QUALITY,11,negative,steak saignant,25,Ik had een steak saignant gevraagd maar deze was medium tot bien cuit.
u,u,u,Review-g2546789-d4542241_2,219,Review-g2546789-d4542241_2:2,,1314,SERVICE#GENERAL,0,negative,NULL,0,Als ik hierover een opmerking maakte kreeg ik hetzelfde vlees gewoon terug met de melding dat ik verkeerd was.
u,u,u,Review-g2546789-d4542241_2,219,Review-g2546789-d4542241_2:3,,1315,FOOD#STYLE_OPTIONS,30,negative,keuken,36,Voor de rest weinig creatieve keuken.
u,u,u,Review-g2546789-d4542241_2,219,Review-g2546789-d4542241_2:4,,1316,RESTAURANT#GENERAL,0,negative,NULL,0,Geen aanrader.
u,u,u,Review-g2546789-d4542241_3,220,Review-g2546789-d4542241_3:1,,1317,SERVICE#GENERAL,89,negative,personeel,98,"Zondag 30 maart, prachtig weer dus terrasje onderweg: Redelijk veel klanten en voldoende personeel dat echter totaal niet geinteresseerd was om de mensen te bedienen."
u,u,u,Review-g2546789-d4542241_3,220,Review-g2546789-d4542241_3:2,,1318,SERVICE#GENERAL,73,negative,kelners,80,"Wij hebben daar een dik halfuur geprobeerd de aandacht te trekken van de kelners, die voorbij slenterden zonder enioge bestelling op te nemen."
u,u,u,Review-g2546789-d4542241_3,220,Review-g2546789-d4542241_3:3,,1319,,,,,,Uiteindelijk zijn we hongerig en dorstig dan maar terug opgestapt.
u,u,u,Review-g2546789-d4542241_3,220,Review-g2546789-d4542241_3:4,,1320,SERVICE#GENERAL,46,negative,bediening,55,"Zulk een een onbeschofte, en ongeintersseerde bediening heb ik nog nergers meegemaakt."
u,u,u,Review-g2546789-d4542241_3,220,Review-g2546789-d4542241_3:5,,1321,,,,,,Gewoon onbegrijpelijk.
u,u,u,Review-g2546789-d4542241_3,220,Review-g2546789-d4542241_3:6,,1322,RESTAURANT#GENERAL,0,negative,NULL,0,Ons zien ze daar NOOIT meer.
u,u,u,Review-g2546789-d4542241_4,221,Review-g2546789-d4542241_4:1,,1323,AMBIENCE#GENERAL,60,positive,tuin,64,""" De jongste telg ""heeft als voornaamste troef de prachtige tuin waar het voor gezinnen met kinderen en grotere groepen goed toeven is, ware het niet dat het huidige management het concept drastisch veranderd heeft."
u,u,u,Review-g2546789-d4542241_4,221,Review-g2546789-d4542241_4:2,,1324,,,,,,"Op zondagnamiddag is er ""animatie"" in de vorm van een ""dinner show"", een arrangementje dat €70,- kost, maar dan krijg je wel entertainment van schlagergoden à la Frank Galan, Danny Fabri, Paul Severs en tutti quanti."
u,u,u,Review-g2546789-d4542241_4,221,Review-g2546789-d4542241_4:3,,1325,,,,,,Alleen maar geschikt voor een beperkt nichepubliek.
u,u,u,Review-g2546789-d4542241_4,221,Review-g2546789-d4542241_4:4,,1326,AMBIENCE#GENERAL,43,negative,tuin,47,"Wij dachten rustig iets te gaan eten in de tuin (dan betaal je de €70,- niet en kan je enkel bestellen uit de snacks-kaart) maar ook daar worden de decibels royaal in je richting gestuurd (arme buren!)."
u,u,u,Review-g2546789-d4542241_4,221,Review-g2546789-d4542241_4:5,,1327,RESTAURANT#GENERAL,0,negative,NULL,0,We hebben snel en zonder smaak gegeten en hebben gemaakt dat we weer weg waren.
u,u,u,Review-g2546789-d4542241_4,221,Review-g2546789-d4542241_4:5,,1327,FOOD#QUALITY,0,negative,NULL,0,We hebben snel en zonder smaak gegeten en hebben gemaakt dat we weer weg waren.
u,u,u,Review-g2546789-d4542241_4,221,Review-g2546789-d4542241_4:6,,1328,,,,,,"Hou je van Vlaamse en andere schlagers: ga ervoor, betaal geen €70,- en zet je in de tuin; hou je er niet van, gewoon wegblijven."
u,u,u,Review-g3492038-d2669477_1,222,Review-g3492038-d2669477_1:1,,1329,,,,,,het nieuwe gebouw lijkt op een openbaar zwembad of turnzaal.
u,u,u,Review-g3492038-d2669477_1,222,Review-g3492038-d2669477_1:2,,1330,,,,,,Hoe haalt men het in z'n hoofd om een zaak met traditie en nostalgie op zo een vreselijke manier te vernieuwen!
u,u,u,Review-g3492038-d2669477_1,222,Review-g3492038-d2669477_1:3,,1331,AMBIENCE#GENERAL,0,negative,NULL,0,gezelligheid is hier mijlen ver te zoeken!
u,u,u,Review-g3492038-d2669477_3,223,Review-g3492038-d2669477_3:1,,1332,RESTAURANT#PRICES,0,neutral,NULL,0,"Je kan hier rustig iets eten en drinken, de prijzen zijn iets hoger als normaal maar je krijgt dan ook wel waar voor je geld."
u,u,u,Review-g3492038-d2669477_3,223,Review-g3492038-d2669477_3:1,,1332,AMBIENCE#GENERAL,0,positive,NULL,0,"Je kan hier rustig iets eten en drinken, de prijzen zijn iets hoger als normaal maar je krijgt dan ook wel waar voor je geld."
u,u,u,Review-g3492038-d2669477_3,223,Review-g3492038-d2669477_3:2,,1333,,,,,,Ook een speeltuin voor de kinderen is aanwezig en in de zomer is het hier ook zeker gezellig vertoeven.
u,u,u,Review-g3492038-d2669477_4,224,Review-g3492038-d2669477_4:1,,1334,SERVICE#GENERAL,0,positive,NULL,0,Geen probleem om in dit restaurant/café nog een maaltijd te krijgen rond 21u30.
u,u,u,Review-g3492038-d2669477_4,224,Review-g3492038-d2669477_4:2,,1335,SERVICE#GENERAL,0,positive,bediening,9,Bediening was vlot en gebeurde snel.
u,u,u,Review-g3492038-d2669477_4,224,Review-g3492038-d2669477_4:3,,1336,,,,,,"Er is in dit etablissement heel wat plaats om te zitten, toch slaagt men er in om zelfs op een weekdag bijna alle plaatsen bezet te krijgen."
u,u,u,Review-g3607018-d1444065_2,225,Review-g3607018-d1444065_2:1,,1337,FOOD#QUALITY,4,positive,ontbijt,11,Het ontbijt was weeral uitstekend!
u,u,u,Review-g3607018-d1444065_2,225,Review-g3607018-d1444065_2:2,,1338,FOOD#STYLE_OPTIONS,0,positive,NULL,0,"Prima organisatie, veel variatie, voor ieder wat wils."
u,u,u,Review-g3607018-d1444065_2,225,Review-g3607018-d1444065_2:2,,1338,SERVICE#GENERAL,6,neutral,organisatie,17,"Prima organisatie, veel variatie, voor ieder wat wils."
u,u,u,Review-g3607018-d1444065_2,225,Review-g3607018-d1444065_2:3,,1339,AMBIENCE#GENERAL,33,positive,interieur,42,"Vriendelijke bediening, gezellig interieur en dat allemaal op een mooie groene locatie."
u,u,u,Review-g3607018-d1444065_2,225,Review-g3607018-d1444065_2:3,,1339,SERVICE#GENERAL,13,positive,bediening,22,"Vriendelijke bediening, gezellig interieur en dat allemaal op een mooie groene locatie."
u,u,u,Review-g3607018-d1444065_2,225,Review-g3607018-d1444065_2:3,,1339,LOCATION#GENERAL,79,positive,locatie,86,"Vriendelijke bediening, gezellig interieur en dat allemaal op een mooie groene locatie."
u,u,u,Review-g3607018-d1444065_2,225,Review-g3607018-d1444065_2:4,,1340,RESTAURANT#GENERAL,0,positive,NULL,0,Wij komen graag nog eens terug!
u,u,u,Review-g3607018-d1444065_4,226,Review-g3607018-d1444065_4:1,,1341,AMBIENCE#GENERAL,14,positive,restaurant,24,"Heel gezellig restaurant in een fantastische omgeving in de bossen, ideaal als fietsstopplaats waar het lekker eten is, maar ook de moeite om gewoon wat gaan te drinken op het gezellige terras naast de gempemolen"
u,u,u,Review-g3607018-d1444065_4,226,Review-g3607018-d1444065_4:1,,1341,LOCATION#GENERAL,45,positive,omgeving,53,"Heel gezellig restaurant in een fantastische omgeving in de bossen, ideaal als fietsstopplaats waar het lekker eten is, maar ook de moeite om gewoon wat gaan te drinken op het gezellige terras naast de gempemolen"
u,u,u,Review-g3607018-d1444065_4,226,Review-g3607018-d1444065_4:1,,1341,FOOD#QUALITY,111,positive,eten,115,"Heel gezellig restaurant in een fantastische omgeving in de bossen, ideaal als fietsstopplaats waar het lekker eten is, maar ook de moeite om gewoon wat gaan te drinken op het gezellige terras naast de gempemolen"
u,u,u,Review-g641779-d740846_1,227,Review-g641779-d740846_1:1,,1342,SERVICE#GENERAL,49,positive,bediening,58,"Heel lekker, vriendelijke ontvangst, super goede bediening, hulpzaam en perfecte uitleg over de gerechten!"
u,u,u,Review-g641779-d740846_1,227,Review-g641779-d740846_1:1,,1342,SERVICE#GENERAL,26,positive,ontvangst,35,"Heel lekker, vriendelijke ontvangst, super goede bediening, hulpzaam en perfecte uitleg over de gerechten!"
u,u,u,Review-g641779-d740846_1,227,Review-g641779-d740846_1:1,,1342,FOOD#QUALITY,0,positive,NULL,0,"Heel lekker, vriendelijke ontvangst, super goede bediening, hulpzaam en perfecte uitleg over de gerechten!"
u,u,u,Review-g641779-d740846_1,227,Review-g641779-d740846_1:2,,1343,RESTAURANT#GENERAL,0,positive,NULL,0,Prijs kwaliteit een perfecte aanrader!
u,u,u,Review-g641779-d740846_1,227,Review-g641779-d740846_1:2,,1343,RESTAURANT#PRICES,0,positive,NULL,0,Prijs kwaliteit een perfecte aanrader!
u,u,u,Review-g641779-d740846_2,228,Review-g641779-d740846_2:1,,1344,FOOD#STYLE_OPTIONS,6,positive,keuzes,12,"Mooie keuzes, zeer evenwichtig, zeer goed opgeleid en vriendelijk personeel."
u,u,u,Review-g641779-d740846_2,228,Review-g641779-d740846_2:1,,1344,SERVICE#GENERAL,66,positive,personeel,75,"Mooie keuzes, zeer evenwichtig, zeer goed opgeleid en vriendelijk personeel."
u,u,u,Review-g641779-d740846_2,228,Review-g641779-d740846_2:2,,1345,FOOD#QUALITY,8,positive,maaltijden,18,"lekkere maaltijden en uitstekende wijnen, wel prijzig."
u,u,u,Review-g641779-d740846_2,228,Review-g641779-d740846_2:2,,1345,DRINKS#QUALITY,34,positive,wijnen,40,"lekkere maaltijden en uitstekende wijnen, wel prijzig."
u,u,u,Review-g641779-d740846_2,228,Review-g641779-d740846_2:2,,1345,RESTAURANT#PRICES,0,negative,NULL,0,"lekkere maaltijden en uitstekende wijnen, wel prijzig."
u,u,u,Review-g641779-d740846_4,229,Review-g641779-d740846_4:1,,1346,,,,,,Wij zijn er al verschillende keren gaan eten.
u,u,u,Review-g641779-d740846_4,229,Review-g641779-d740846_4:2,,1347,RESTAURANT#GENERAL,0,positive,NULL,0,Telkens weer GENIETEN!!
u,u,u,Review-g641779-d740846_4,229,Review-g641779-d740846_4:3,,1348,SERVICE#GENERAL,19,positive,gastvrouw,28,Super vriendelijke gastvrouw!
u,u,u,Review-g641779-d740846_4,229,Review-g641779-d740846_4:4,,1349,FOOD#QUALITY,19,positive,eten,23,Fantastisch lekker eten!
u,u,u,Review-g641779-d740846_4,229,Review-g641779-d740846_4:5,,1350,FOOD#QUALITY,0,positive,NULL,0,Een echt smaakfestival!
u,u,u,Review-g641779-d740846_4,229,Review-g641779-d740846_4:6,,1351,RESTAURANT#GENERAL,0,positive,NULL,0,Tot nu toe geen enkel ander restaurant gevonden dat hieraan kan tippen!
u,u,u,Review-g641781-d741267_1,230,Review-g641781-d741267_1:1,,1352,RESTAURANT#GENERAL,0,negative,NULL,0,Onvriendelijke mensen -knettergek -slechtste eten ooit -don't go there!!!!
u,u,u,Review-g641781-d741267_1,230,Review-g641781-d741267_1:1,,1352,FOOD#QUALITY,45,negative,eten,49,Onvriendelijke mensen -knettergek -slechtste eten ooit -don't go there!!!!
u,u,u,Review-g641781-d741267_1,230,Review-g641781-d741267_1:1,,1352,SERVICE#GENERAL,15,negative,mensen,21,Onvriendelijke mensen -knettergek -slechtste eten ooit -don't go there!!!!
u,u,u,Review-g641781-d741267_1,230,Review-g641781-d741267_1:2,,1353,,,,,,En dan klagen de mensen in de horeca...
u,u,u,Review-g641781-d741267_2,231,Review-g641781-d741267_2:1,,1354,FOOD#STYLE_OPTIONS,72,negative,soepje van asperge,90,"in het kader van een flairbon hebben wij gereserveerd bij ""de mein"" het soepje van asperge was lekker doch geen brood, boter bij geserveerd."
u,u,u,Review-g641781-d741267_2,231,Review-g641781-d741267_2:1,,1354,FOOD#QUALITY,72,positive,soepje van asperge,90,"in het kader van een flairbon hebben wij gereserveerd bij ""de mein"" het soepje van asperge was lekker doch geen brood, boter bij geserveerd."
u,u,u,Review-g641781-d741267_2,231,Review-g641781-d741267_2:2,,1355,FOOD#QUALITY,3,negative,rundsbrochette,17,de rundsbrochette was doorregen en taai (alle 5 blokjes op de spies) en at als een kauwgom.
u,u,u,Review-g641781-d741267_2,231,Review-g641781-d741267_2:3,,1356,SERVICE#GENERAL,83,negative,ober,87,"de vis (zalm) at lekker, doch tafel naast ons vroeg een beetje botersaus bij en de ober antwoordde: ""saus is op."
u,u,u,Review-g641781-d741267_2,231,Review-g641781-d741267_2:3,,1356,FOOD#QUALITY,3,negative,vis,6,"de vis (zalm) at lekker, doch tafel naast ons vroeg een beetje botersaus bij en de ober antwoordde: ""saus is op."
u,u,u,Review-g641781-d741267_2,231,Review-g641781-d741267_2:4,,1357,FOOD#STYLE_OPTIONS,7,negative,derde gang,17,Bij de derde gang was er geen crème brullée in het aanbod terwijl dit wel in de bon opgegeven was.
u,u,u,Review-g641781-d741267_2,231,Review-g641781-d741267_2:5,,1358,,,,,,Bij het afsluiten van de avond vroegen wij om een decafeïne koffie
u,u,u,Review-g641781-d741267_2,231,Review-g641781-d741267_2:6,,1359,DRINKS#STYLE_OPTIONS,0,negative,NULL,0,"u raadt het antwoord: ""Is er niet""."
u,u,u,Review-g641781-d741267_2,231,Review-g641781-d741267_2:7,,1360,,,,,,de nacht die erop volgde was een hel.
u,u,u,Review-g641781-d741267_2,231,Review-g641781-d741267_2:8,,1361,FOOD#QUALITY,0,negative,NULL,0,mijn vrouw de helenacht overgegeven en diaree.
u,u,u,Review-g641781-d741267_2,231,Review-g641781-d741267_2:9,,1362,RESTAURANT#PRICES,0,negative,NULL,0,Dus eindconclusie: nog teveel betaald en om 18u stipt binnengekomen en om 21.15u buiten gegaan.
u,u,u,Review-g641781-d741267_2,231,Review-g641781-d741267_2:9,,1362,SERVICE#GENERAL,0,negative,NULL,0,Dus eindconclusie: nog teveel betaald en om 18u stipt binnengekomen en om 21.15u buiten gegaan.
u,u,u,Review-g641781-d741267_2,231,Review-g641781-d741267_2:10,,1363,SERVICE#GENERAL,3,negative,ober,7,De ober was ook niet overdreven vriendelijk en vrij stuurs...
u,u,u,Review-g641781-d741267_3,232,Review-g641781-d741267_3:1,,1364,SERVICE#GENERAL,0,negative,NULL,0,"na niet genoterde reservatie (volgens vivabox) hebben ze ons nooit willen dienen, en dit na anderhalf uur wachten."
u,u,u,Review-g641781-d741267_3,232,Review-g641781-d741267_3:2,,1365,,,,,,Proficiat en succes in de toekomst..
u,u,u,Review-g641781-d741267_4,233,Review-g641781-d741267_4:1,,1366,FOOD#QUALITY,0,negative,NULL,0,Ronduit schandalig wat ze serveren.
u,u,u,Review-g641781-d741267_4,233,Review-g641781-d741267_4:2,,1367,FOOD#QUALITY,0,negative,NULL,0,Nog nooit zo slecht gegeten.
u,u,u,Review-g641781-d741267_4,233,Review-g641781-d741267_4:3,,1368,FOOD#QUALITY,0,negative,steppegras met soepvlees,24,steppegras met soepvlees gekregen die eventjes tss gril gestoken heeft.
u,u,u,Review-g641781-d741267_4,233,Review-g641781-d741267_4:4,,1369,FOOD#QUALITY,0,negative,NULL,0,Komt zelfs niet in aanmerking voor frituur.
u,u,u,Review-g641781-d741267_4,233,Review-g641781-d741267_4:5,,1370,RESTAURANT#GENERAL,0,negative,NULL,0,Stop gewoon hiermee.
u,u,u,Review-g641785-d1140849_2,234,Review-g641785-d1140849_2:1,,1371,SERVICE#GENERAL,0,negative,NULL,0,Naar mijn beleving was er voor de lunch buiten gereserveerd maar het bleek binnen in een apart zaaltje.
u,u,u,Review-g641785-d1140849_2,234,Review-g641785-d1140849_2:2,,1372,AMBIENCE#GENERAL,0,negative,NULL,0,Het was bijzonder gehorig en lawaaierig.
u,u,u,Review-g641785-d1140849_2,234,Review-g641785-d1140849_2:3,,1373,FOOD#QUALITY,4,positive,eten,8,Het eten was prima maar ik zou toch een plezieriger ambiance verkiezen op een mooie voorjaarsdag..............
u,u,u,Review-g641785-d1140849_2,234,Review-g641785-d1140849_2:3,,1373,AMBIENCE#GENERAL,52,neutral,ambiance,60,Het eten was prima maar ik zou toch een plezieriger ambiance verkiezen op een mooie voorjaarsdag..............
u,u,u,Review-g641785-d1140849_3,235,Review-g641785-d1140849_3:1,,1374,,,,,,Vooraf een menu afgesproken voor een groep van 10 personen.
u,u,u,Review-g641785-d1140849_3,235,Review-g641785-d1140849_3:2,,1375,RESTAURANT#PRICES,24,positive,3-gangen keuzemenu,42,"Correcte prijs voor een 3-gangen keuzemenu (telkens vis of vlees), inclusief dranken en aperitief."
u,u,u,Review-g641785-d1140849_3,235,Review-g641785-d1140849_3:3,,1376,FOOD#QUALITY,0,positive,NULL,0,"Kwaliteit zeker in orde, tot tevredenheid van de deelnemers."
u,u,u,Review-g641785-d1140849_3,235,Review-g641785-d1140849_3:4,,1377,,,,,,Bedankt!
u,u,u,Review-g641785-d1140849_4,236,Review-g641785-d1140849_4:1,,1378,,,,,,Via kennissen hadden wij het advies gekregen hier ook eens te gaan tafelen.
u,u,u,Review-g641785-d1140849_4,236,Review-g641785-d1140849_4:2,,1379,,,,,,Wij gingen hier eten de avond voor valentijn.
u,u,u,Review-g641785-d1140849_4,236,Review-g641785-d1140849_4:3,,1380,,,,,,Er was nog net een tafeltje van 2 vrij en bestelden de Valentijnsmenu.
u,u,u,Review-g641785-d1140849_4,236,Review-g641785-d1140849_4:4,,1381,RESTAURANT#GENERAL,0,positive,NULL,0,Het eten was echt heel lekker en wisten al dadelijk dat we eigenlijk hier vaker moeten komen.
u,u,u,Review-g641785-d1140849_4,236,Review-g641785-d1140849_4:4,,1381,FOOD#QUALITY,4,positive,eten,8,Het eten was echt heel lekker en wisten al dadelijk dat we eigenlijk hier vaker moeten komen.
u,u,u,Review-g641785-d1140849_4,236,Review-g641785-d1140849_4:5,,1382,RESTAURANT#GENERAL,0,positive,NULL,0,Echt een aanrader om eens lekker te gaan eten.
u,u,u,Review-g641785-d1140849_4,236,Review-g641785-d1140849_4:6,,1383,SERVICE#GENERAL,0,positive,NULL,0,Bovendien was er aan het einde van de maaltijd nog een leuk kadootje ter attentie van valentijn.
u,u,u,Review-g641788-d6213349_1,237,Review-g641788-d6213349_1:1,,1384,SERVICE#GENERAL,0,negative,NULL,0,Reserveren een hopeloze zaak.
u,u,u,Review-g641788-d6213349_1,237,Review-g641788-d6213349_1:2,,1385,SERVICE#GENERAL,0,negative,NULL,0,"2x gereserveerd, 2x niet op de lijst!!!!"
u,u,u,Review-g641788-d6213349_1,237,Review-g641788-d6213349_1:3,,1386,SERVICE#GENERAL,0,negative,NULL,0,"Bevestigingsmail van Social Deal getoond, kom, geef maar, en zet u!"
u,u,u,Review-g641788-d6213349_1,237,Review-g641788-d6213349_1:4,,1387,SERVICE#GENERAL,0,neutral,NULL,0,welkom!
u,u,u,Review-g641788-d6213349_1,237,Review-g641788-d6213349_1:5,,1388,,,,,,vergeet het maar...
u,u,u,Review-g641788-d6213349_1,237,Review-g641788-d6213349_1:6,,1389,SERVICE#GENERAL,0,negative,NULL,0,1/2 uur gewacht op eerste tapas.
u,u,u,Review-g641788-d6213349_1,237,Review-g641788-d6213349_1:7,,1390,FOOD#QUALITY,28,neutral,serranoham met stokbrood,52,"viel redelijk mee, maar aan serranoham met stokbrood kan niet veel tegenvallen."
u,u,u,Review-g641788-d6213349_1,237,Review-g641788-d6213349_1:8,,1391,FOOD#STYLE_OPTIONS,48,negative,portie,54,Nog een 1/2 uur wachten op alweer een miniscule portie.
u,u,u,Review-g641788-d6213349_1,237,Review-g641788-d6213349_1:8,,1391,SERVICE#GENERAL,0,negative,NULL,0,Nog een 1/2 uur wachten op alweer een miniscule portie.
u,u,u,Review-g641788-d6213349_1,237,Review-g641788-d6213349_1:9,,1392,,,,,,tapas eten zoveel...als je wilt??
u,u,u,Review-g641788-d6213349_1,237,Review-g641788-d6213349_1:10,,1393,SERVICE#GENERAL,0,negative,NULL,0,"zij beslissen hoeveel je eet, als je geluk hebt krijg je 4x3 porties, als ze er geen zin in hebben, zul je het met minder moeten doen!"
u,u,u,Review-g641788-d6213349_1,237,Review-g641788-d6213349_1:11,,1394,SERVICE#GENERAL,33,negative,bazin,38,"Dienster deed haar best, maar de bazin (?) mag best een cursus onthaal volgen, bah bah."
u,u,u,Review-g641788-d6213349_1,237,Review-g641788-d6213349_1:11,,1394,SERVICE#GENERAL,0,positive,dienster,8,"Dienster deed haar best, maar de bazin (?) mag best een cursus onthaal volgen, bah bah."
u,u,u,Review-g641788-d6213349_1,237,Review-g641788-d6213349_1:12,,1395,SERVICE#GENERAL,0,negative,NULL,0,"Kan 'zogezegd' niet goed Nederlands, Wat een lachertje, was zich aan het beklagen tegen bekenden over Social Deal en de toeloop van gasten die deze formule met zich meebracht, in perfekt Nederlands..."
u,u,u,Review-g641788-d6213349_1,237,Review-g641788-d6213349_1:13,,1396,,,,,,"Bestaat 1 jaar nu, ben benieuwd hoe het er volgend jaar uitziet."
u,u,u,Review-g641788-d6213349_1,237,Review-g641788-d6213349_1:14,,1397,RESTAURANT#GENERAL,0,negative,NULL,0,"Denk niet dat veel mensen voor een 2de maal gaan, wat uiteindelijk toch de bedoeling is."
u,u,u,Review-g641788-d6213349_1,237,Review-g641788-d6213349_1:15,,1398,FOOD#QUALITY,34,neutral,kok,37,"Gemiste kans, jammer, want aan de kok ligt het niet."
u,u,u,Review-g641788-d6213349_2,238,Review-g641788-d6213349_2:1,,1399,SERVICE#GENERAL,0,negative,NULL,0,"Met hele gezin gaan eten om 19.00 uur, om 19.30 kregen wij de drankkaart, om 19.40 moesten wij de bestelling voor het eten pas doorgeven."
u,u,u,Review-g641788-d6213349_2,238,Review-g641788-d6213349_2:2,,1400,SERVICE#GENERAL,0,negative,NULL,0,Niets van de door ons bestelde tapas kwam tegelijk op tafel en er ontbraken ook een aantal tapas die wij wel hadden doorgegeven.
u,u,u,Review-g641788-d6213349_2,238,Review-g641788-d6213349_2:3,,1401,SERVICE#GENERAL,0,negative,bediening,9,"Bediening zeer slecht, terwijl er niet veel klandizie was."
u,u,u,Review-g641788-d6213349_2,238,Review-g641788-d6213349_2:4,,1402,SERVICE#GENERAL,0,negative,NULL,0,Alles was hen teveel.
u,u,u,Review-g641788-d6213349_2,238,Review-g641788-d6213349_2:5,,1403,SERVICE#GENERAL,66,negative,serveerster,77,Wij zouden 2 uur onbeperkt tapas kunnen eten maar om 20.55 zei de serveerster dat de keuken om 21.00 uur gesloten was.
u,u,u,Review-g641788-d6213349_2,238,Review-g641788-d6213349_2:6,,1404,FOOD#QUALITY,0,negative,eten,4,"Eten was zeer slecht, we hadden nog beter naar een frituur kunnen gaan!!"
u,u,u,Review-g641788-d6213349_2,238,Review-g641788-d6213349_2:7,,1405,RESTAURANT#GENERAL,0,negative,NULL,0,Geen aanrader dus!!!!
u,u,u,Review-g641788-d6213349_3,239,Review-g641788-d6213349_3:1,,1406,SERVICE#GENERAL,119,negative,mevrouw van de bediening,143,"Het eten wat lekker maar de bejegening afschuwelijk, geen uitleg en met pijn en moeite 2x kunnen bestellen (waarbij de mevrouw van de bediening ook nog ongeduldig op haar horloge keek) als je zwaaide/riep op of een of andere manier de aandacht van haar wilde trekken leek ze dit gewoon te negeren."
u,u,u,Review-g641788-d6213349_3,239,Review-g641788-d6213349_3:1,,1406,SERVICE#GENERAL,28,negative,bejegening,38,"Het eten wat lekker maar de bejegening afschuwelijk, geen uitleg en met pijn en moeite 2x kunnen bestellen (waarbij de mevrouw van de bediening ook nog ongeduldig op haar horloge keek) als je zwaaide/riep op of een of andere manier de aandacht van haar wilde trekken leek ze dit gewoon te negeren."
u,u,u,Review-g641788-d6213349_3,239,Review-g641788-d6213349_3:1,,1406,FOOD#QUALITY,4,positive,eten,8,"Het eten wat lekker maar de bejegening afschuwelijk, geen uitleg en met pijn en moeite 2x kunnen bestellen (waarbij de mevrouw van de bediening ook nog ongeduldig op haar horloge keek) als je zwaaide/riep op of een of andere manier de aandacht van haar wilde trekken leek ze dit gewoon te negeren."
